Update

UPDATE <tablename> SET <columnanem>=<newdata> WHERE (condition);

UPDATE cats SET breed='Shorthair' WHERE breed='tabby';

mysql> UPDATE cats SET breed='Shorthair' WHERE breed='tabby';
Query OK, 2 rows affected (0.17 sec)
Rows matched: 2  Changed: 2  Warnings: 0

mysql> SELECT * FROM CATS;
+--------+----------------+------------+------+
| cat_id | name           | breed      | age  |
+--------+----------------+------------+------+
|      1 | Ringo          | Shorthair  |    4 |
|      2 | Cindy          | Maine Coon |   10 |
|      3 | Dumbledore     | Maine Coon |   11 |
|      4 | Egg            | Persian    |    4 |
|      5 | Misty          | Shorthair  |   13 |
|      6 | George Michael | Ragdoll    |    9 |
|      7 | Jackson        | Sphynx     |    7 |
+--------+----------------+------------+------+
7 rows in set (0.01 sec)

mysql> UPDATE cats SET age=14 WHERE name='Misty';
Query OK, 1 row affected (0.15 sec)
Rows matched: 1  Changed: 1  Warnings: 0

mysql> SELECT * FROM CATS;
+--------+----------------+------------+------+
| cat_id | name           | breed      | age  |
+--------+----------------+------------+------+
|      1 | Ringo          | Shorthair  |    4 |
|      2 | Cindy          | Maine Coon |   10 |
|      3 | Dumbledore     | Maine Coon |   11 |
|      4 | Egg            | Persian    |    4 |
|      5 | Misty          | Shorthair  |   14 |
|      6 | George Michael | Ragdoll    |    9 |
|      7 | Jackson        | Sphynx     |    7 |
+--------+----------------+------------+------+
7 rows in set (0.02 sec)